,title,pays,deadline,lien,remaining_times
0,"Request To Establish An Accreditation Panel For The Provision Of Information Technology Assurance Services, Internal Audit And Risk Management Services, Forensic Audit Services And Supply Chain Management Audit Services To …",afrique-du-sud,2023-10-31,https://www.j360.info/appels-d-offres/39657912-request-to-establish-an-accreditation-panel-for-the-provision-of/,22.0 days
1,"Appointment of a service provider for the provision of ICT Security and Cybersecurity services, Trend Micro and Mimecast licenses and support for DTPC for a period of three (3) years",afrique-du-sud,2023-11-08,https://www.j360.info/appels-d-offres/39657902-appointment-of-a-service-provider-for-the-provision-of-ict/,30.0 days
2,Supply and Delivery Hardware Renovation Material,afrique-du-sud,2023-10-12,https://www.j360.info/appels-d-offres/39657895-supply-and-delivery-hardware-renovation-material/,3.0 days
3,SUPPLY AND DELIVERY OF TWO (2) CAMERAS AND SIXTEEN (16) POWERBANKS,afrique-du-sud,2023-10-13,https://www.j360.info/appels-d-offres/39657896-supply-and-delivery-of-two-2-cameras-and-sixteen-16/,4.0 days
4,MANUFACTURE SUPPLY AND DELIVERY OF RTI DECALS,afrique-du-sud,2023-10-13,https://www.j360.info/appels-d-offres/39657886-manufacture-supply-and-delivery-of-rti-decals/,4.0 days
5,BUSINESS PROCESS MANAGEMENT SERVICES,afrique-du-sud,2023-10-31,https://www.j360.info/appels-d-offres/39657882-business-process-management-services/,22.0 days
6,Provision of ICT Support and Maintenance,afrique-du-sud,2023-10-31,https://www.j360.info/appels-d-offres/39657876-provision-of-ict-support-and-maintenance/,22.0 days
7,UPGRADE OF CONTROL & INSTRUMENTATION SYSTEM (RE-ISSUE),afrique-du-sud,2023-10-30,https://www.j360.info/appels-d-offres/39648024-upgrade-of-control-instrumentation-system-re-issue/,21.0 days
8,"APPOINTMENT OF A SERVICE PROVIDER TO SUPPLY, DELIVER, INSTALL, MIGRATE, CONFIGURE, SUPPORT AND MAINTAIN SERVERS AND STORAGES AT THE NNR OFFICES FOR A PERIOD OF THREE (3) YEARS",afrique-du-sud,2023-10-26,https://www.j360.info/appels-d-offres/39648018-appointment-of-a-service-provider-to-supply-deliver-install-migrate/,17.0 days
9,Request For Acquisition Of Suitable Office Space For SITA Cape Town Through An Operating Lease Agreement For A Period Of Five (5) Years. Compulsory Virtual Briefing Session Will Be Held …,afrique-du-sud,2023-10-31,https://www.j360.info/appels-d-offres/39647996-request-for-acquisition-of-suitable-office-space-for-sita-cape/,22.0 days
10,MATAIELE LOCAL MUNICIPALITY COUNCIL CHAMBER AUDIO CONFERENCE SYSTEM,afrique-du-sud,2023-11-06,https://www.j360.info/appels-d-offres/39647988-mataiele-local-municipality-council-chamber-audio-conference-system/,28.0 days
11,"Appointment Of A Supplier(S) To Supply, Install New Water Coolers And Maintenance Of Water Coolers At SITA Gauteng Buildings And Including All The Regions For A Period Of Three Years …",afrique-du-sud,2023-10-31,https://www.j360.info/appels-d-offres/39647993-appointment-of-a-suppliers-to-supply-install-new-water-coolers/,22.0 days
12,T/ING/042/2023q – Supply and Delivery of a New Pipe Inspection Camera,afrique-du-sud,2023-10-13,https://www.j360.info/appels-d-offres/39647982-ting0422023q-supply-and-delivery-of-a-new-pipe-inspection/,4.0 days
13,SUPPLY AND DELIVERY OF PORTABLE SOUND SYSTEMS FOR COMMUNICATIONS,afrique-du-sud,2023-10-11,https://www.j360.info/appels-d-offres/39647969-supply-and-delivery-of-portable-sound-systems-for-communications/,2.0 days
14,APPOINTMENT OF A STRATEGIST TO CONDUCT A NUMBER OF WORKSHOPS WITH VARIOUS MANAGEMENT GROUPS TO ASSIST SANParks TO CO-CREATE A ROADMAP WITH THE AIM OF BECOMING A PEOPLE CENTRIC; SMART …,afrique-du-sud,2023-10-13,https://www.j360.info/appels-d-offres/39647951-appointment-of-a-strategist-to-conduct-a-number-of-workshops/,4.0 days
15,"Request For Accreditation (RFA) Panel Of Cloud Service Providers For The Provisioning Of IAAS, PAAS, SAAS AND XAAS For The SITA Marketplace For A Period Of Five (05) Years",afrique-du-sud,2023-10-30,https://www.j360.info/appels-d-offres/39647939-request-for-accreditation-rfa-panel-of-cloud-service-providers-for/,21.0 days
16,Appointment of a service provider to enable digital accessibility of real estate related information,afrique-du-sud,2023-11-07,https://www.j360.info/appels-d-offres/39638188-appointment-of-a-service-provider-to-enable-digital-accessibility-of/,29.0 days
17,INVITATION FOR AN OPEN TENDER TO PROVIDE RESTAURANT SERVICES TO THE INNOVATION HUB MANANGEMENT COMPANY (SOC) FOR A PERIOD OF FIVE (5) YEARS.,afrique-du-sud,2023-10-27,https://www.j360.info/appels-d-offres/39638190-invitation-for-an-open-tender-to-provide-restaurant-services-to/,18.0 days
18,Appointment of a suitable and experienced service provider to supply and deliver 516 tablets.,afrique-du-sud,2023-10-30,https://www.j360.info/appels-d-offres/39638184-appointment-of-a-suitable-and-experienced-service-provider-to-supply/,21.0 days
19,6X Third Generation digital FM Radio Modulation Analyser and Monitoring Receiver,afrique-du-sud,2023-10-13,https://www.j360.info/appels-d-offres/39638182-6x-third-generation-digital-fm-radio-modulation-analyser-and-monitoring/,4.0 days
20,"APPOINTMENT OF A SERVICE PROVIDER FOR THE BESPOKE SOFTWARE DEVELOPMENT, CUSTOMISATION/ENHANCEMENT, MAINTENANCE AND SUPPORT SERVICES OF THE OHSC INFORMATION SYSTEM FOR THREE YEARS",afrique-du-sud,2023-10-27,https://www.j360.info/appels-d-offres/39638174-appointment-of-a-service-provider-for-the-bespoke-software-development/,18.0 days
21,"Service provider to Supply and deliver ADC DUAL/STEREO Bantam TT patch cables 2M, ADC Single/Mono Bantam TT patch cables 2M, Sentech Head Office.",afrique-du-sud,2023-10-17,https://www.j360.info/appels-d-offres/39638162-service-provider-to-supply-and-deliver-adc-dualstereo-bantam-tt/,8.0 days
22,TELEMETRY SYSTEM INSTALLATION AND MAINTENANCE FOR JOE GQABI DISTRICT MUNICIPALITY FOR A PERIOD OF THREE (3) YEARS,afrique-du-sud,2023-11-17,https://www.j360.info/appels-d-offres/39638164-telemetry-system-installation-and-maintenance-for-joe-gqabi-district-municipality/,39.0 days
23,MEDITATION ROOFS,afrique-du-sud,2024-01-31,https://www.j360.info/appels-d-offres/39636888-meditation-roofs/,114.0 days
24,"INTERNATIONAL CALL FOR ART, ArtMaze Magazine Edition 36",afrique-du-sud,2023-10-19,https://www.j360.info/appels-d-offres/39636887-international-call-for-art-artmaze-magazine-edition-36/,10.0 days
25,SUPPLY & DELIVERY OF 3 LAPTOPS,afrique-du-sud,2023-10-13,https://www.j360.info/appels-d-offres/39636784-supply-delivery-of-3-laptops/,4.0 days
26,APPOINTMENT OF A SERVICE PROVIDER TO RENDER CATERING SERVICES FOR THE BLOEMFONTEIN STAFF MEETING ON THE 18 OCTOBER 2023,afrique-du-sud,2023-10-12,https://www.j360.info/appels-d-offres/39636778-appointment-of-a-service-provider-to-render-catering-services-for/,3.0 days
27,APPOINTMENT OF A SERVICE PROVIDER TO RENDER CATERING SERVICES FOR CAPE TOWN STAFF MEETING ON THE 18 OCTOBER 2023,afrique-du-sud,2023-10-12,https://www.j360.info/appels-d-offres/39636779-appointment-of-a-service-provider-to-render-catering-services-for/,3.0 days
28,"Appointment of a service provider for the continued hosting, maintenance, support and enhancement of the existing ideal health facility information systems for the National Department of Health for a period …",afrique-du-sud,2023-10-30,https://www.j360.info/appels-d-offres/39636781-appointment-of-a-service-provider-for-the-continued-hosting-maintenance/,21.0 days
29,FOR THE INSTALLATION OF SECURITY AND ACCESS CONTROL FOR DMS AT MEGAWATT PARK FOR A PERIOD OF 3 MONTHS,afrique-du-sud,2023-10-31,https://www.j360.info/appels-d-offres/39636782-for-the-installation-of-security-and-access-control-for-dms/,22.0 days
30,FOR THE INSTALLATION OF SECURITY AND ACCESS CONTROL FOR DMS AT MEGAWATT PARK FOR A PERIOD OF 3 MONTHS,afrique-du-sud,2023-10-31,https://www.j360.info/appels-d-offres/39636775-for-the-installation-of-security-and-access-control-for-dms/,22.0 days
31,Traffic data management system and traffic counting equipment,afrique-du-sud,2023-11-10,https://www.j360.info/appels-d-offres/39636771-traffic-data-management-system-and-traffic-counting-equipment/,32.0 days
32,APPOINTMENT OF A SERVICE PROVIDER TO RENDER CATERING SERVICES FOR THE GQEBERHA STAFF MEETING ON THE 18 OCTOBER 2023,afrique-du-sud,2023-10-12,https://www.j360.info/appels-d-offres/39636747-appointment-of-a-service-provider-to-render-catering-services-for/,3.0 days
33,Development of a content management website for Senqu Local Municipality,afrique-du-sud,2023-11-07,https://www.j360.info/appels-d-offres/39636748-development-of-a-content-management-website-for-senqu-local-municipality/,29.0 days
34,"REQUEST FOR PROPOSAL FOR THE DEVELOPMENT OF INTEGRATED SOLUTION/ERP (ENTERPRISE RESOURCE PLANNING) FOR A PERIOD OF 60 MONTHS, (24 MONTHS DEVELOPMENT AND 36 MONTHS MAINTENANCE AND SUPPORT OF THE DEVELOPED …",afrique-du-sud,2023-10-26,https://www.j360.info/appels-d-offres/39636740-request-for-proposal-for-the-development-of-integrated-solutionerp-enterprise/,17.0 days
35,APPOINTMENT OF A SERVICE PROVIDER TO RENDER CATERING SERVICES FOR THE DURBAN STAFF MEETING ON THE 18 OCTOBER 2023,afrique-du-sud,2023-10-12,https://www.j360.info/appels-d-offres/39636742-appointment-of-a-service-provider-to-render-catering-services-for/,3.0 days
36,IUCN Supplier-Prequalification-Kenya,afrique-du-sud,2023-10-23,https://www.j360.info/appels-d-offres/39630077-iucn-supplier-prequalification-kenya/,14.0 days
37,IUCN Supplier-Prequalification-South Africa,afrique-du-sud,2023-10-23,https://www.j360.info/appels-d-offres/39630074-iucn-supplier-prequalification-south-africa/,14.0 days
38,Consultancy Services for the ERP Software for RPCL,afrique-du-sud,2023-10-17,https://www.j360.info/appels-d-offres/39629440-consultancy-services-for-the-erp-software-for-rpcl/,8.0 days
39,Appointment of a service provider to facilitate further rollout of the ideal clinic realisation and maintenance (ICRM) programme for a period of three (03) years.,afrique-du-sud,2023-11-02,https://www.j360.info/appels-d-offres/39629027-appointment-of-a-service-provider-to-facilitate-further-rollout-of/,24.0 days
40,THE APPOINTMENT OF A SERVICE PROVIDER TO SUPPLY AND INSTALL AN ACCESS CONTROL BIOMETRIC/TAG READERS EQUIPPED WITH MAGNETIC LOCK AT THE HEAD OFFICE NATIONAL RESEARCH FOUNDATION IN PRETORIA.,afrique-du-sud,2023-10-12,https://www.j360.info/appels-d-offres/39629024-the-appointment-of-a-service-provider-to-supply-and-install/,3.0 days
41,"Supply and delivery of recording machines for journalist ,desktop computers for admin use, marketing road signages to be in a strategic areas outside Broadcasting Van and office furniture at Maputaland …",afrique-du-sud,2023-11-13,https://www.j360.info/appels-d-offres/39629020-supply-and-delivery-of-recording-machines-for-journalist-desktop-computers/,35.0 days
42,"Supply, Delivery, and Installation of Scoreboards, Sight Screens and Lockers at Hawston Sportsgrounds.",afrique-du-sud,2023-10-18,https://www.j360.info/appels-d-offres/39629008-supply-delivery-and-installation-of-scoreboards-sight-screens-and-lockers/,9.0 days
43,Supply and Delivery of Tactical Equipment,afrique-du-sud,2023-10-18,https://www.j360.info/appels-d-offres/39629007-supply-and-delivery-of-tactical-equipment/,9.0 days
44,ORACLE SUPPORT (SENIOR DATABASE ADMINISTRATOR (DBA) AND TWO PRINCIPAL ANALYSTS) FOR A PERIOD OF THREE (3) YEARS,afrique-du-sud,2023-10-31,https://www.j360.info/appels-d-offres/39628998-oracle-support-senior-database-administrator-dba-and-two-principal-analysts/,22.0 days
45,PROCUREMENT OF PHOTOGRAPHIC EQUIPMENT FOR MASS DIGITILISATION CENTRE MUSEUM AFRICA,afrique-du-sud,2023-10-12,https://www.j360.info/appels-d-offres/39628993-procurement-of-photographic-equipment-for-mass-digitilisation-centre-museum-africa/,3.0 days
46,"Suitably experienced service providers are invited to submit quotations for a 12-month contract period to host, maintain, and support Iziko Museum’s websites and online presence.",afrique-du-sud,2023-10-16,https://www.j360.info/appels-d-offres/39628989-suitably-experienced-service-providers-are-invited-to-submit-quotations-for/,7.0 days
47,SASSA hereby invites service provider/s for the provision of Open Text (CLM live link) for a period of 3 years,afrique-du-sud,2023-10-30,https://www.j360.info/appels-d-offres/39628982-sassa-hereby-invites-service-providers-for-the-provision-of-open/,21.0 days
48,REQUEST FOR UPGRADING SCOPTEL PBX TELEPHONE SYSTEM TO MS TEAMS PHONE SYSTEM FOR PERIOD OF 12 MONTHS,afrique-du-sud,2023-10-12,https://www.j360.info/appels-d-offres/39628981-request-for-upgrading-scoptel-pbx-telephone-system-to-ms-teams/,3.0 days
49,Secure mail gateway license's for a period of 3 years,afrique-du-sud,2023-10-11,https://www.j360.info/appels-d-offres/39628984-secure-mail-gateway-licenses-for-a-period-of-3-years/,2.0 days
50,Umalusi requests a quotation to appoint a service provider for the provision of a three (3)-year contract for the SAGE Intacct software solution for 18 users.,afrique-du-sud,2023-10-10,https://www.j360.info/appels-d-offres/39628974-umalusi-requests-a-quotation-to-appoint-a-service-provider-for/,1.0 days
51,Awarded: Supply and Delivery of Weather Station in Brackenfell,afrique-du-sud,2023-11-10,https://www.j360.info/appels-d-offres/39624167-awarded-supply-and-delivery-of-weather-station-in-brackenfell/,32.0 days
52,"THE UPGRADING OF SAN STORAGE (PURE STORAGE FA-M50R2 ARRAY) FOR THE FINANCIAL INTELLIGENCE CENTRE, WITH SUPPORT AND MAINTENANCE FOR A PERIOD OF FIVE (5) YEARS.",afrique-du-sud,2023-10-27,https://www.j360.info/appels-d-offres/39624168-the-upgrading-of-san-storage-pure-storage-fa-m50r2-array-for/,18.0 days
53,"APPOINTMENT OF AN EXPERIENCED, QUALIFIED, AND ACCREDITED TRAINING SERVICE PROVIDER FOR THE PROVISION OF A DIGITAL MARKETING SHORT COURSE",afrique-du-sud,2023-10-10,https://www.j360.info/appels-d-offres/39622310-appointment-of-an-experienced-qualified-and-accredited-training-service-provider/,1.0 days
54,"SUPPLY, DELIVERY, INSTALLATION AND MAINTAINING OF PERRFOMANCE MANAGEMENT SYSTEM",afrique-du-sud,2023-10-30,https://www.j360.info/appels-d-offres/39622280-supply-delivery-installation-and-maintaining-of-perrfomance-management-system/,21.0 days
55,Provision of an Framework for an integrated security system,afrique-du-sud,2023-10-23,https://www.j360.info/appels-d-offres/39622259-provision-of-an-framework-for-an-integrated-security-system/,14.0 days
56,Appointment of a service provider for the provisioning of internet services for the Nelson Mandela Museum at Qunu Youth & Heritage Centre.,afrique-du-sud,2023-10-12,https://www.j360.info/appels-d-offres/39611993-appointment-of-a-service-provider-for-the-provisioning-of-internet/,3.0 days
57,Design and installation of a 150Kw Battery backup system for existing Solar Plant,afrique-du-sud,2023-10-30,https://www.j360.info/appels-d-offres/39611988-design-and-installation-of-a-150kw-battery-backup-system-for/,21.0 days
58,APPOINTMENT OF A COMPETENT AND ACCREDITED SERVICE PROVIDER FOR THE PROVISION OF DIGITAL/ELECTRONIC SIGNATURES FOR A PERIOD OF TWELVE (12) MONTHS.,afrique-du-sud,2023-10-25,https://www.j360.info/appels-d-offres/39611991-appointment-of-a-competent-and-accredited-service-provider-for-the/,16.0 days
59,SUPPLY AND DELIVERY OF PORTABLE SOUND SYSTEMS FOR COMMUNICATIONS,afrique-du-sud,2023-10-09,https://www.j360.info/appels-d-offres/39611971-supply-and-delivery-of-portable-sound-systems-for-communications/,0.0 days
60,APPOINTMENT OF SUITABLE SERVICE PROVIDERS OR IMPLEMENTING AGENTS TO SUPPORT THE IMPLEMENTATION OF THE COMMUNITY WORK PROGRAMME (CWP) FOR A PERIOD OF SIX (06) MONTHS.,afrique-du-sud,2023-10-26,https://www.j360.info/appels-d-offres/39611972-appointment-of-suitable-service-providers-or-implementing-agents-to-support/,17.0 days
61,"INVITATION OF PROSPECTIVE BIDDERS FOR SUPPLY, SETUP AND DELIVERY OF EIGHT (8) HIGH VOLUME IMAGE SCANNERS FOR THE EASTERN CAPE REGION AS PER SITA RFB 740.",afrique-du-sud,2023-10-26,https://www.j360.info/appels-d-offres/39611964-invitation-of-prospective-bidders-for-supply-setup-and-delivery-of/,17.0 days
62,Leasing of photocopier machine for the period of 36 months,afrique-du-sud,2023-10-24,https://www.j360.info/appels-d-offres/39611951-leasing-of-photocopier-machine-for-the-period-of-36-months/,15.0 days
63,"APPOINTMENT OF A SUITABLE SERVICE PROVIDER WHO WILL PROVIDE THREE DAY TRAINING ON RESEARCH DATA ANALYSIS AND INTERPRETATION, LOGICAL FRAMEWORK APPROACH AND REPORT WRITING FOR THE UDA STAFF",afrique-du-sud,2023-10-10,https://www.j360.info/appels-d-offres/39596422-appointment-of-a-suitable-service-provider-who-will-provide-three/,1.0 days
64,"Appointment of Service Provider(s) for Skills Development Training (Soft Skills, Communications, Risk & Governance and Leadership & Management)",afrique-du-sud,2023-10-11,https://www.j360.info/appels-d-offres/39596424-appointment-of-service-providers-for-skills-development-training-soft-skills/,2.0 days
65,SUPPLY AND DELIVER OF FIVE (5) LAPTOPS,afrique-du-sud,2023-10-13,https://www.j360.info/appels-d-offres/39596414-supply-and-deliver-of-five-5-laptops/,4.0 days
66,Request for Quotation for Support and Maintenance of the ESRI ArcGIS system at Rand Water for a period of 12 months or 1440 hours.,afrique-du-sud,2023-10-09,https://www.j360.info/appels-d-offres/39596417-request-for-quotation-for-support-and-maintenance-of-the-esri/,0.0 days
67,"PROVISION OF DEDICATED INTERNET CONNECTION, EMAIL OR DOMAIN HOSTING AND TELEPHONE SYSTEM FOR UDDA FOR THE PERIOD OF THREE YEARS",afrique-du-sud,2023-11-01,https://www.j360.info/appels-d-offres/39596409-provision-of-dedicated-internet-connection-email-or-domain-hosting-and/,23.0 days
68,"PROVISION FOR THE MULTI-UTILITY ONLINE VENDING SYSTEM INCLUDING THIRD-PARTY VENDING, TID AND REVENUE ENHANCEMENTOF ELECTRICAL VENDING SERVICES FOR 3 YEARS",afrique-du-sud,2023-11-02,https://www.j360.info/appels-d-offres/39596392-provision-for-the-multi-utility-online-vending-system-including-third-party-vending/,24.0 days
69,APPOINTMENT OF A SERVICE PROVIDER FOR THE PROVISION OF COMMUNICATIONS TOOL FOR A PERIOD OF SIXTY (60) MONTHS,afrique-du-sud,2023-10-12,https://www.j360.info/appels-d-offres/39596388-appointment-of-a-service-provider-for-the-provision-of-communications/,3.0 days
70,APPOINTMENT OF A PROFESSIONAL SERVICES PROVIDER TO DEVELOP A DETAILED PLAN FOR THE ICT INFRASTRUCTURE NETWORK AT FETAKGOMO TUBATSE SPECIAL ECONOMIC ZONE,afrique-du-sud,2023-10-20,https://www.j360.info/appels-d-offres/39596378-appointment-of-a-professional-services-provider-to-develop-a-detailed/,11.0 days
71,"Bid for the supply, delivery, installation, commissioning, and maintenance of telemetry systems for water supply systems for Midvaal Local Municipality on an as and when required basis from date of …",afrique-du-sud,2023-11-06,https://www.j360.info/appels-d-offres/39596373-bid-for-the-supply-delivery-installation-commissioning-and-maintenance-of/,28.0 days
72,The Provision of Institutionalised Training within Limlanga Cluster over a period of 5 years,afrique-du-sud,2023-10-26,https://www.j360.info/appels-d-offres/39596367-the-provision-of-institutionalised-training-within-limlanga-cluster-over-a/,17.0 days
73,"The Maintenance of CCTV security surveillance system, Access Control System, FSD System, EVAC System and Public Addressing System and the provision of spares on an ""as- and- when"" required for …",afrique-du-sud,2023-11-02,https://www.j360.info/appels-d-offres/39596360-the-maintenance-of-cctv-security-surveillance-system-access-control-system/,24.0 days
74,"REQUEST FOR QUOTATION TO APPOINT A SUITABLE AND QUALIFIED SERVICE PROVIDER FOR PRODUCTION OF FIXED DISPLAY MATERIAL, CAMPAIGN EXECUTION AND PROJECT MANAGEMENT: SECURING FLOOR SPACE, DESIGN, BUILDING, BREAKDOWN OF THE …",afrique-du-sud,2023-10-11,https://www.j360.info/appels-d-offres/39596362-request-for-quotation-to-appoint-a-suitable-and-qualified-service/,2.0 days
75,"APPOINTMENT OF A SERVICE PROVIDER TO DESIGN UMZINYATHI DISTRICT DEVELOPMENT AGENCY WEBSITE, HOSTING AND MAINTENANCE FOR THE PERIOD OF 12 MONTHS",afrique-du-sud,2023-10-10,https://www.j360.info/appels-d-offres/39596363-appointment-of-a-service-provider-to-design-umzinyathi-district-development/,1.0 days
76,Q 2023/054: RENEWAL OF ESRI MAINTENANCE AGREEMENT FOR 12 MONTHS,afrique-du-sud,2023-10-13,https://www.j360.info/appels-d-offres/39596355-q-2023054-renewal-of-esri-maintenance-agreement-for-12-months/,4.0 days
77,FuturArc Prize 2024: Architecture for Life After,afrique-du-sud,2024-02-08,https://www.j360.info/appels-d-offres/39587188-futurarc-prize-2024-architecture-for-life-after/,122.0 days
78,ELECTRONIC SAFE,afrique-du-sud,2023-10-09,https://www.j360.info/appels-d-offres/39586738-electronic-safe/,0.0 days
79,"SUPPLY, DELIVERY AND INSTALLATION OF REMOTE METER SETTING FRANKING MACHINE FOR TRFFIC CAMERA OFFICE",afrique-du-sud,2023-10-11,https://www.j360.info/appels-d-offres/39586734-supply-delivery-and-installation-of-remote-meter-setting-franking-machine/,2.0 days
80,Proposal for ICT Strategy Review Facilitation Services.,afrique-du-sud,2023-11-17,https://www.j360.info/appels-d-offres/39586733-proposal-for-ict-strategy-review-facilitation-services/,39.0 days
81,Proposal for Intranet Development and Implementation.,afrique-du-sud,2023-11-17,https://www.j360.info/appels-d-offres/39586728-proposal-for-intranet-development-and-implementation/,39.0 days
82,Supply & Install Electronic Access Control System (EACS)(ARC-TSC)Nelspruit,afrique-du-sud,2023-10-13,https://www.j360.info/appels-d-offres/39586722-supply-install-electronic-access-control-system-eacsarc-tscnelspruit/,4.0 days
83,Replace dysfunctional Turnstiles with new full height single and double turnstiles fitted with touchless biometric systems and no contact alcohol breathalyzers including 2x vehicle barriers at Zuikerbosch Water Treatment Plant.,afrique-du-sud,2023-10-26,https://www.j360.info/appels-d-offres/39586723-replace-dysfunctional-turnstiles-with-new-full-height-single-and-double/,17.0 days
84,"Appointment of a service provider to assist Agrément South Africa with Internet Connection, Firewall and Installation of 2 Fibre Lines (100mbps Each with Load Balancing) at Hatfield Offices for 24 …",afrique-du-sud,2023-10-17,https://www.j360.info/appels-d-offres/39586707-appointment-of-a-service-provider-to-assist-agr%C3%A9ment-south-africa/,8.0 days
85,SOCIO- ECONOMIC DATABASE USER RIGHTS OR LICENCE AND ASSOCIATED SUPPORT,afrique-du-sud,2023-10-13,https://www.j360.info/appels-d-offres/39586702-socio-economic-database-user-rights-or-licence-and-associated-support/,4.0 days
86,"SUPPLY, DELIVERY, INSTALLATION AND COMMISSIONING OF AN ASSET MANAGEMENT TRACKING SOLUTION FOR MOVABLE ASSETS ( INCLUDING COMPATIBLE MOBILE HANDHELD SCANNERS) AND THE PROVISION OF SOFTWARE MAINTENANCE AND SUPPORT FOR A …",afrique-du-sud,2023-11-06,https://www.j360.info/appels-d-offres/39578687-supply-delivery-installation-and-commissioning-of-an-asset-management-tracking/,28.0 days
87,APPOINTMENT OF A REPUTABLE SERVICE PROVIDER TO SUPPLY AND DELIVER 35 LAPTOPS,afrique-du-sud,2023-10-16,https://www.j360.info/appels-d-offres/39578685-appointment-of-a-reputable-service-provider-to-supply-and-deliver/,7.0 days
88,REQUEST FOR QUOTATION FOR THE UPGRADE OF LENOVO WARRANTIES TO INCLUDE ACCIDENTAL DAMAGE PROTECTION,afrique-du-sud,2023-10-11,https://www.j360.info/appels-d-offres/39578675-request-for-quotation-for-the-upgrade-of-lenovo-warranties-to/,2.0 days
89,Supply Of Cisco EA And SFC Renewals To The Government Pensions Administration Agency (GPAA) For A Period Of Thirty-Six (36) Months.,afrique-du-sud,2023-10-27,https://www.j360.info/appels-d-offres/39578677-supply-of-cisco-ea-and-sfc-renewals-to-the-government/,18.0 days
90,"TO SUPPLY AND IMPLEMENT A DOCUMENT SCANNING AND CAPTURE SYSTEM INCLUDING SOFTWARE LICENSES, MAINTENANCE, SUPPORT AND PROFESSIONAL SERVICES FOR A SYSTEM PERIOD OF (36) THIRTY SIX MONTHS",afrique-du-sud,2023-11-07,https://www.j360.info/appels-d-offres/39578678-to-supply-and-implement-a-document-scanning-and-capture-system/,29.0 days
91,Safelight Paper Solo Shows - Berlin,afrique-du-sud,2023-10-29,https://www.j360.info/appels-d-offres/39576572-safelight-paper-solo-shows-berlin/,20.0 days
92,THE PROCUREMENT OF MODELLING SERVICE TO PROVIDE ANALYTICS AND DECISION-SUPPORT FOR ESKOM’S MANAGEMENT OF ITS COAL STOCK LEVELS AT THE COAL-FIRED POWER STATIONS FOR A PERIOD OF THREE YEARS,afrique-du-sud,2023-11-06,https://www.j360.info/appels-d-offres/39576353-the-procurement-of-modelling-service-to-provide-analytics-and-decision-support/,28.0 days
93,Provision of Zero Trust Implementation,afrique-du-sud,2023-10-13,https://www.j360.info/appels-d-offres/39576350-provision-of-zero-trust-implementation/,4.0 days
94,SUPPLY PTS SAMPLES FOR DETECTION OF CRYPTOSPORIDIUM AND GIARDIA METHOD -FAPAS LEAP PTS SAMPLES FAPAS SUSPENSION A FWPA1 TWO RUNS 2024: DW050 + DW052 AND ONE RUN 2025: DW054. FAPAS …,afrique-du-sud,2023-10-09,https://www.j360.info/appels-d-offres/39576343-supply-pts-samples-for-detection-of-cryptosporidium-and-giardia-method/,0.0 days
95,"APPOINTMENT OF SERVICE PROVIDERS FOR THE SUPPLY AND DELIVERY, INSTALLATION AND COMMISSIONING OF DIMENSION MEASURING INSTRUMENT (PROFILE PROJECTOR)",afrique-du-sud,2023-10-12,https://www.j360.info/appels-d-offres/39576337-appointment-of-service-providers-for-the-supply-and-delivery-installation/,3.0 days
96,"APPOINTMENT OF A PANEL OF SERVICE PROVIDERS FOR THE FOLLOWING SERVICES: MARKETING, PUBLIC RELATIONS, EVENTS MANAGEMENT, MEDIA BUYING, WEBSITE AND DIGITAL SERVICES, BRANDING AND PROMOTIONAL ITEMS FOR TSHWANE ECONOMIC DEVELOPMENT …",afrique-du-sud,2023-11-02,https://www.j360.info/appels-d-offres/39576327-appointment-of-a-panel-of-service-providers-for-the-following/,24.0 days
